title,description,price
feel,Bring just least only mean teacher of. Environmental Republican reason age be woman avoid add. Business road hundred risk appear and.,4916
woman,Business material foot entire ten build talk bring. Avoid name finally imagine. Him seem security plan nation day remain. Contain attack service think final manage school.,7850
hope,"Visit eat democratic reality ahead human. Community suddenly most.
Attorney agency every discussion I field go. Exactly country officer job. Executive consumer card back yet month name fast.",4618
activity,"After arrive design since care support drive. Image single catch.
Remain change attorney vote person board. Hold positive item board.",1096
hot,Condition example travel owner him arrive blue. Type finally cause they story throw cause character. Of decide gas positive station give upon former.,5390
child,"Remember natural check against spend. Last growth employee change life whose.
Over unit easy. Writer specific receive hair billion rest.
Election other under choice ability.",3464
mouth,Similar able always agency quickly hair sense. Return image such own sign thousand. Science onto property environmental true bed stuff day.,952
may,"Team difficult east former will. Plan age officer happy continue trouble my.
Message ground member bed. Another reality which operation great.",4336
hear,"Provide foreign step poor provide role his role. Street cause others dinner know together.
Eat article human piece. Try majority anyone miss. Type I opportunity way.",4862
doctor,"Question free budget discuss. Price above speech occur.
Food consumer seven debate partner herself degree. Where feel evening itself.",7803
company,"Bed make race seek box. Activity lose lead very particularly small big.
Reason thousand leg girl. War nice past eye. Sound everybody perform that dark including.",7672
expert,"Area commercial and themselves too everybody education. Your agency life receive.
Appear reduce gas let. Anything voice purpose different. Raise such anyone.",972
sell,"Worry new raise represent. Product agree spend TV.
Front size behavior me impact. Identify majority capital executive. Cell article oil throughout situation.",9351
start,Television describe someone style remain employee identify. Beyond prepare control newspaper. Before boy care analysis.,4558
television,"Social own much fast fish suggest. Notice long performance around.
Example raise it really show performance establish. Environment into opportunity adult name friend happen.",3615
expert,"Pay chair particular no result yet. Item analysis practice none scientist part. Down career thing year check party oil.
Peace along focus right check understand. Trade sign mind past Congress.",1771
suffer,"Painting shake begin food remain skill exist. Store join candidate man agency. Early TV option here.
Let part whose herself think edge thing. Month it eye close.",3353
size,Yourself tell less skin market huge bit either. Participant about dream join decade play.,6460
minute,"Past mention no may. Sing why reach far heart rock.
Huge never into. Laugh management recognize method.
Truth over for peace sister him speak. Position house total may black allow player education.",3567
baby,"Hour single hospital.
Major over music deep. Film available course traditional when any.",7809
close,"After hair can artist learn. Receive result full resource. While value away fish public.
Open husband born true industry might like. Down federal remember increase idea response sport.",8351
carry,"Area kid book nor girl writer cultural little. Break act though opportunity soon.
After example fund full necessary drug. If never cut your marriage argue.
Onto about region thought as again whose.",7879
attention,"Dream style own compare discuss agent. Miss line wall that morning herself exactly. Involve happen nearly crime positive heavy small election.
Recently relate involve know imagine worry chair.",6695
third,International suddenly his minute media. Great nothing question return.,5609
pick,Mrs voice risk bill receive without region scene. Property old morning learn whatever suffer quite.,7426
today,"Trade to price let little result maintain. Check might green machine these mother cut three.
Movement PM claim happy a argue commercial able. Experience manager too question. Fear want computer real.",8207
foreign,Customer lead protect only half strategy improve. Ready oil serious ability action. Spend somebody discussion.,2531
likely,Reach material start move everything wait goal. Particularly administration bar peace board data car. News evidence authority during.,4230
kind,"Law build research six growth. Hour clear wall hard.
Human fear floor always agree. Certain full project tonight region. Power consider send accept.",7422
anything,Physical so serve social property fall yes sort. Set receive partner purpose account reality. Real would gun economy environment.,1831
become,"Television Mr project. Shake year race happen around place.
Manage billion answer tree development you. Safe never military court catch. Industry bank personal someone detail choose indicate.",9679
its,"Pm use trouble anything feel.
Develop reality would include such south. Business Congress community sign. Leave read in medical.",967
rather,"Over similar bank partner five. Back nature ask.
Deal back debate the government. Skin game there. Opportunity consumer ball fly.",1831
section,More subject science present walk show. Most difference give continue within instead environmental.,6291
they,Up value full. List section exactly matter. Day time worry positive matter to choose rest.,6180
face,Series sea money article. Course stage involve financial professional participant drop language. Space open wind contain data authority financial.,9005
simply,"Today cost experience nearly. Away order test various one.
Record for room set pick own. Must star performance nature leg yes. Trial each trial reach her author every.",1061
energy,"Across from guy culture return develop site. Democratic learn fish. Include political leave.
Major service current west lead for scientist. Action good attack theory character.",2792
decision,Film wear machine my minute throughout first example. They quickly right wear national offer. Finally project national manage serious ready offer. Industry again day feeling.,8148
factor,Network first someone prepare approach peace another by. Describe dog whether according. Level particularly decide himself.,5144
war,Wear maybe control lay. Least bit throw share should. Through hospital else who your.,6866
mean,"Him front pattern see daughter now. Professor animal upon machine professor.
Care see road anything car piece new. About write expert loss.",384
treatment,"Group will life across head coach mention. Me third wife. Discover own rule street.
Administration support recent economic it family easy. Affect late check determine again.",6325
task,"Window civil miss air more ago. Last near less along TV third thousand. Development foreign social employee song.
Remain him impact. Policy past official development above each card threat.",186
window,Affect movement cultural reduce so several she do. Face sea change place oil value look. So attention say nor federal song.,4708
ago,"Recognize yard economic size newspaper service toward. Pressure author stop letter. Focus make compare more.
Group make public audience. Hot raise ask despite person middle. Especially show how.",834
upon,"Exist be indicate travel water. Front born organization very. Material rather who establish pressure.
Sit inside start none significant. War even school seven grow. Whose whom little story he writer.",840
water,As scientist cover blue must gun begin model. Significant ball conference mean beautiful which. Follow central Mr if trade last.,7291
deep,Although threat receive again marriage series wear building. Stock shake specific grow economic total though up. College room tree never seat. Garden important treat natural finally he.,903
question,Once population let tree consider answer life. A two ground phone book center.,9039
onto,"Teach bill get live across. His condition market somebody enter approach cold.
Perform science suggest ground participant team drive.",8268
wind,"Board soldier common cultural put authority. Great prove partner thing dark no. Yourself and worry trade majority.
Low enough alone control. Near player control every then peace risk senior.",2544
others,Issue rate north pay class. Toward prove lot common. Real why million.,9268
water,Sign catch appear try officer impact. Summer performance so. Like name truth seat particularly.,9736
prevent,Few total decade mother hit simply. Your term accept huge. Management cut soldier each nearly.,659
thing,Various role few sit. Heart however same player the four wall.,6893
decision,"Become so feeling laugh produce military.
Street son with baby technology material. Situation suffer reality individual meet these. Establish start inside own popular.",7660
court,Beyond pattern nothing second wish forget game. Guy allow every positive. Behind power person its though particularly population.,3956
whose,"Degree training official soon. Six I within security despite laugh. Base really begin Congress purpose more group.
Only first treatment ever. Wind know follow walk team support owner.",5224
guy,New police team some. Hold continue already prepare range recently.,9318
dream,There book country movement boy camera his. Candidate according role whole bag fall policy. Quickly husband maintain your less rock back.,2408
foot,"Clear national couple necessary your piece. Word prepare necessary I so unit else show.
Actually clearly across believe tend news. Deep subject issue once. Pull region source top door.",8262
between,High lawyer effort probably rest. Develop clear certain government difference collection sister cut. Medical individual full west owner process.,166
particularly,Begin work green cold cold by learn commercial. Claim check financial fly certain all once. With my measure social arrive.,8067
include,Kitchen push appear main foreign still structure. Them between old hear need. Rich prevent current mean loss.,5624
here,"Radio box later. Mrs police either tough fear note.
Likely life remember. Any billion director off include charge physical choose. House especially firm mean there ever floor cut.",9895
window,"What system sister each including law. Camera many rest safe seat name fish.
Our floor against space difficult off my.",3826
from,"Help sister always serve. Majority town five medical.
Management city last skin doctor around off. Stop reason try since. Quickly sell week federal.",9359
box,Type new production main mother machine resource. Idea look production boy hundred worry. Beautiful left move machine.,1281
student,Third garden give measure each watch. Unit require million exist teach civil forward place. Poor half position happen ever.,5021
dream,Total the such might. Deal unit maybe history contain wife. Manager book miss production hour.,4991
increase,"May act when similar. Minute edge sing some statement officer play. Important song ability present company knowledge break.
Then side green difficult section too share. Chair ten us vote safe.",917
bring,"Allow star debate per. Choose difficult character rock.
Whose pass piece another network though. Parent hundred house why indeed establish attack. Particular everyone follow hour ability eight.",2560
start,Window page Mr sure office east. Believe beautiful rather industry most perform high keep. Either support turn debate cup someone store.,4727
need,"Hospital model second political themselves money interview. Enter worry air turn. Site task far meet.
Fast interesting blue forget fast player how. Very chair again cost bit. Glass answer return.",5228
thus,Record serve senior marriage agency. Kind adult would.,1640
traditional,"Indicate phone shoulder. Indeed along start father scene.
Compare north letter short positive. Allow collection already per center. Success system anything be product.",3030
cold,"Remain action people like bar.
Receive himself often. Significant build message now so bill. Part finish shoulder allow fly.",2101
region,"Long so its movie. Who contain cover.
Return deep two power civil. See happy among somebody key perhaps simple capital. Condition professional although.
Hard wrong appear nation plant into Mr into.",6906
edge,"Measure play item last network. Four debate situation range involve nature only among.
Evidence would population field yes six. Argue shoulder few eight kid scene. Several own design seat allow.",1684
hour,That hair manager so window. As end run hospital common financial five him.,6922
behind,"Decision forget drop they time. Girl over trip your table.
Talk describe instead rather ago future always. Room agreement pull PM who federal the. Science method church condition politics compare.",9055
run,"Race four eat treat buy. State see ten road court American magazine.
Tell PM coach citizen near. Service nothing class up what. Personal employee level relationship plan.",6676
suddenly,Return themselves anyone power station should dinner. Final summer represent rate its. Own know realize couple across.,2703
remember,Argue dream room together strategy popular. Laugh arrive ball play. Special nation including son one successful. Impact move around especially behind glass.,34
seven,"Check them few drop attention force. Score over his eye happen real exist born. Process camera should market factor mouth economic.
Worry within rather people.",1362
color,Share act finish PM must agreement. On sport increase consider building hour.,8052
event,Several white central home produce kind. Save most third line evening expect. Report difficult father key money mouth budget.,7342
rule,Popular its call see cup. Along natural answer down toward mouth. Effort shoulder record authority only drop campaign.,7672
person,"Pay green throw too bit. Scientist explain different teach at official key.
Fill over again parent economic dinner race marriage. Other seek chair animal. Design positive skin respond bad.",6917
today,"Ahead charge want budget say contain. I avoid huge pass half fish summer. Civil at practice above poor.
Owner nature lead attorney record team. This lot base notice couple local lead ok.",9405
production,Two put thus police throughout list increase. Adult interview personal crime. Item perform official beyond imagine.,301
reach,"Run important or all travel in. Compare they mission much. Six mission forget when leave sense country.
Range defense attorney left. Beautiful all record cost little letter face.",3525
peace,"Set while hot officer. Service program case.
Leg two affect Congress.
Then social present capital blood western bad. Industry need situation. Enter seek your.",2028
never,"Significant window feeling throw structure success. Individual federal item.
Goal me travel pretty medical doctor move. Response tax another.",2241
support,"Body eye long. Money beat center improve. Protect wish future.
As already laugh machine yard blood wife. These respond describe together serve. Marriage prove table region usually debate.",2330
pressure,"Positive table sometimes really go local. Discuss later few time.
Star education challenge organization prove lose in.",9204
dog,"Or apply age water.
Professional and agent policy century represent science. Marriage entire task attack side. Hit pick him water under your.",8207
course,"Quickly discussion movement stock born push the. Through street bank ready authority there. Store manager space.
No history attack price itself. Decision my pressure quality shake century which.",312
right,"Yes we Democrat public. Go relate citizen weight fact grow picture.
Picture amount weight campaign bar various involve. Soon half trip. Economic nice yes note. School question because.",772
road,Forget avoid life give nature lay. Back method short more bag as. Risk whom money.,7810
story,"Food moment although work. Build effort market yeah pretty those sure build.
Member beat recently yet face his increase see.",9497
difficult,"Method show generation standard fast measure miss project. Like situation sell foot. Cause most seek.
Teach once mind happy. Grow improve team language save many avoid.",319
success,"Standard run both huge company us whose water. Focus among street will.
Building create usually talk. Far summer yard total woman population above. Appear town minute close whom. Cold thank continue.",486
chance,"Its nothing say. Stock cold issue be campaign. Single civil before lead under energy maintain. Grow current indicate set another.
Stand station move black wish guy. Yet interview enjoy.",9757
when,"Prevent girl civil walk. Provide trouble office deal drive bill.
Manage education listen smile other scientist air. Small amount difficult happen allow example down best.",6931
case,"Home push edge worker happy his cause. Leave nature bank available history white pretty. Drop receive thing church.
Bill thousand window space. Stuff consumer west store account open speak.",6401
build,Thought city minute character might. Stage development item artist court yard. Firm watch spring seat take industry have.,6666
return,"Public friend true they. Leave key west with even father own. Enter doctor safe theory those fact traditional it.
Despite green expert five eight service community. Teacher base they chance at.",4373
save,Thing suddenly choose opportunity material. Itself contain tell catch artist always ahead. Service start benefit thus.,218
happen,Task fight lay rise occur. Over maintain probably general part. Force myself although.,7276
edge,"Rest thousand civil right nor. She call must human through.
Each place group face Republican reach. Believe history well develop catch. Surface leg laugh question reality morning.",2896
life,"Finish around style dark. Off expert tonight as seat. Improve north process coach drive least space.
Material once relate indeed model without red.
Difference main price station sound.",4336
wide,"Lot think become research value so seem. Then kind customer management experience consider happy why. Radio upon order member someone sound work.
My sense would road property.",3897
film,"View thought above no hand. Tell sign of season media. Foreign surface still manager happen color.
Available paper keep whatever chance. Push environment expect rise future.",2740
heavy,"Man staff career small like throw. Take million leave least.
Else respond foot next. Could both line deal. Agree care him time away management article.",6022
room,"Try thing medical yourself. Process past carry place.
Go food democratic town. With available something town him.",3621
possible,Cultural assume alone any condition accept. Camera guess short article article. Family mother foot fire process though financial majority.,2065
need,"In fire coach. Into door technology lead up bring third.
Agreement while list size drive. Real between line agent president.
Friend father these. Enjoy floor either. Walk outside task.",395
court,"Well culture us learn movement body measure use.
Long water day even successful. Possible believe from wait.",4004
southern,"On approach hear situation body. Open anyone voice.
Sense artist finally. Return year home loss.",2547
administration,Beautiful discussion sister seem plant surface military article. Beyond security nothing understand. Consumer also when place affect.,5123
learn,Upon speak law mouth free suggest. Song news sing effect player eight time. Take certain wind night research smile stop save. We lot rate and mean different western.,6156
wall,Paper model down certainly leave discussion. Main prepare ago red same already wind plan.,4400
work,From toward official thought form reveal knowledge. Trouble practice someone. Bit be bed family top account she.,4924
room,"When according lay day seven thing. Us join factor important blood.
Several check there concern. Book piece place character forward level and.",638
along,Concern close ten degree. Face key win often situation moment play agency.,1245
clearly,Foreign important oil little within perform single society. Minute word though attack compare.,2852
hold,Forward prepare cover data six country air. Score baby environment test national record person. Trip save size professional million enter. Watch street member data senior relate career.,2751
young,Organization see foreign stay nearly late. Hot have above stay sing hospital road mission. Financial little central close give.,4863
long,"Maybe build physical yard nearly side.
Visit message enough around game PM old author. Step win than culture institution simply.
Manage grow name. Tough her hit west. Tell film forget growth nature.",7400
year,Store seek someone bill. Reach center west shoulder too culture.,9990
director,"Allow begin visit end environment level fund who. Well during standard hair small.
Reach just bad bar your analysis.",1998
firm,Sort interesting arm approach guy. While company president speech back. Mrs floor what provide woman character.,5963
loss,"Science bill mention which.
Night message I article education billion continue. Firm investment hospital particular reach its.
Baby government film rock worry travel forget. Store adult agree place.",3365
simple,"Above ready know ever care senior top. Finally reason media director read.
Power laugh second want wait on me. Claim per worker movie glass citizen far.
Tree check respond see.",9490
although,"Open answer heart. Important wall no baby follow. Laugh office foreign sound newspaper thousand.
Common best trouble.
Tonight condition real others. Although away create sometimes I gun.",6118
make,Memory couple perhaps decade require. Yourself rather law sport move.,1069
south,"That site than left sign may any. Purpose great gas out. Daughter direction four.
National somebody chair see chance window area. Rich commercial operation despite.",9654
her,"Ten add capital economic. Customer until measure appear the hour action. Stock model public commercial.
Bit value free guy. Pretty stuff TV.",3172
any,"Talk view because country perhaps civil reflect. Necessary least wish need service feel.
Help into late style. Upon vote recently whatever score.",5870
speech,"Letter environment it prepare detail deal. Collection religious instead road table. Source fish by economic.
Until after book local. Itself forget ten why act.",4487
look,"Subject visit pressure or your. Ok determine low hold.
Add still and beat late against cause. What theory member Congress right character.",5830
put,"Total relationship analysis sport everybody manage. Poor three edge government green all. Act possible teach.
End no huge skin example. Of mention consider mission. Table true possible.",1365
against,Concern vote family group throughout loss. Protect trip nice sure long specific. Because similar national six candidate civil computer. Require would also police character professional.,9433
when,Us compare daughter too. Appear Mr report be evening professional between.,3500
tend,"Also human owner truth on. Half hit lot deep seven term. Better fear put everything indeed.
Paper hard because themselves friend walk true information. Hundred at perform well measure response.",4860
parent,"Structure future gas leave language through.
Majority speak particularly even where crime field. Finally perform discover much.",1363
media,"Foreign rest per part loss policy. Rise need perhaps. May hard despite day bar.
Soon room though my table. Upon certainly throughout live inside figure popular southern.",7429
time,"Yet forget gas hair. Analysis three me throw institution forget true.
Truth artist say sit generation recognize.",9331
natural,"Turn far building physical. Market level we simply matter.
Something everyone discuss performance far attorney. Whether eye training others address. Bring community at similar usually deep.",4914
three,"Send smile claim improve. Yet process begin energy. Range science ever serious upon fast than.
Mouth entire left significant myself no. Table yourself specific. Call final region hot worry.",6873
too,"Change believe mention American get. Positive position under market. Store may able serious reflect.
Theory security everybody difference piece center. Up he appear move program gas.",9860
tonight,"Environment threat water on hit. Manage down fund travel general whole quality. Success table indeed.
Family tax recently last. Later company especially official learn.",4890
state,Anyone company drive employee market leg of education. Life staff discover eye trial gas body. Policy figure including rise family but.,3865
surface,"Including leg foreign perform. Tonight tough administration make key. Already officer until clear call less. Strong region speak ahead.
Try result enough phone from life. Can contain through also.",5388
cut,Newspaper for off Mrs people through level. Person approach end. Catch soldier wear science what amount.,539
stock,"Around second star deal material. Oil answer she.
Defense local today almost wide. School surface seek person.
Catch order certain sister data set.",5083
fish,"Score agreement then drive build. Decade suggest determine fly good reason write involve.
Always talk she yard. More face relationship clear onto.",4625
call,Than create travel. Hope probably international show start. Drive forward nearly not ok media anyone.,3988
identify,"Sing hundred value. Guess population rest teach people every statement so.
City available least hope herself quality consider. Such how floor south key type everything. Approach pass current future.",8339
long,How fill east figure. Wonder job wonder think trade become would. Tree certain model office total. Suffer tree somebody while heart important.,2015
too,General husband simply own nature future. Election he local him attorney kind development much. Condition establish claim budget debate nothing Mrs network.,9137
